{
  "format": 1,
  "version": "2026.10.21.1",
  "minApp": "0.1.0",
  "createdUtc": "2026-10-21T00:00:00Z",
  "channel": "stable",
  "files": [
    {
      "path": "codes/codes.json",
      "sha256": "63e9c791dd4be5fb3044bd80b8d20515a90a770a0cdcf405d09dfb86426bf763",
      "size": 41874
    },
    {
      "path": "collectors/collectors.json",
      "sha256": "d915a57d5f53f12d143818fedd1e3d8c10b989e64f7f04bcc32c2667849b86ff",
      "size": 7586
    },
    {
      "path": "conflicts/anticheat.json",
      "sha256": "9d37ba8538e87b06de7c37aa6826abb4485123d05d346d6c08488d842e757a9b",
      "size": 6016
    },
    {
      "path": "conflicts/antivirus.json",
      "sha256": "d91685b1bd8a2bf0b501a5a1abf57bd5677c847da563f60d66d628f4f83ca304",
      "size": 14832
    },
    {
      "path": "conflicts/audio.json",
      "sha256": "06fa7acc513b4092774dd0bb4ae3bd22845691581761b33d31ea4e0eb805e7de",
      "size": 7156
    },
    {
      "path": "conflicts/driver.json",
      "sha256": "5f59e9a603270732f02e005ed4aff6b64b5b7be3b0d5d984e90f8452f084b32f",
      "size": 9972
    },
    {
      "path": "conflicts/monitoring.json",
      "sha256": "c6370b7c05d90cf7572be1239770466d7716898399a91b0abc6187389b08abe5",
      "size": 3927
    },
    {
      "path": "conflicts/network_optimizer.json",
      "sha256": "ada45afe7f927cce6a4cf6603fcbd94341f6da94f0257dc22d61c485af19fc9c",
      "size": 5663
    },
    {
      "path": "conflicts/other.json",
      "sha256": "eb6c83afa4315fee206bd3b9cfb44820cf09c6e7046a60ed71c541187fd94f05",
      "size": 19635
    },
    {
      "path": "conflicts/overlay.json",
      "sha256": "a864a9d0ef31170ab6e51c20f3d72e30f1da6ef6115208e8442f18847068929c",
      "size": 12234
    },
    {
      "path": "conflicts/rgb_vendor.json",
      "sha256": "d251752ae7444fb53def9dfa257aef73d37d01321756a766d53b8027722aa91e",
      "size": 14534
    },
    {
      "path": "conflicts/tweak_tool.json",
      "sha256": "e069f316cf420727849f25f82c1b5e4344d769fd94f2dac1daec739d5b80d000",
      "size": 8997
    },
    {
      "path": "conflicts/virtualization.json",
      "sha256": "f8a495c0a95430cd4c6cfaa0a278af692e672c4eac7a112080f21bd7bac5b102",
      "size": 8135
    },
    {
      "path": "conflicts/vpn.json",
      "sha256": "4ee975900c8c92b66150fb9578ab73c45e8355c0e6ea30a54a7be26cbcdf4863",
      "size": 18577
    },
    {
      "path": "fixes/audio/fix.audio.bt_handsfree_off.json",
      "sha256": "022a0732d05a6aa008332569a6d0b25b36d2c7472af41baf600c9e01e5b8dda4",
      "size": 1324
    },
    {
      "path": "fixes/display/fix.display.disable_fso.json",
      "sha256": "5d292dc1e15e7fafc9cc384b665500fe96d3a61ad5d703c13602954e3573663d",
      "size": 1310
    },
    {
      "path": "fixes/display/fix.display.game_dvr_off.json",
      "sha256": "629571e6cce7469fb5ec0a4a3c345d70d3e54c060f99c505a6af5b350e75543f",
      "size": 1509
    },
    {
      "path": "fixes/display/fix.display.gpu_pref_high.json",
      "sha256": "6cd1e4a9e38520e35a8899a88d49c0485a4581de7eae537019023b9188fcc186",
      "size": 1344
    },
    {
      "path": "fixes/display/fix.display.hags_off.json",
      "sha256": "a23c61857868c8d79eda138537fe9864b363d309a3df8633faa62e8fefcf5cac",
      "size": 1379
    },
    {
      "path": "fixes/display/fix.display.mpo_off.json",
      "sha256": "e39511a587dd5bc1e965bda3e2aadb8cb010b9ca5e22776a0186dc382c376d8b",
      "size": 1326
    },
    {
      "path": "fixes/generic/fix.generic.close_process.json",
      "sha256": "9129065adebc04a44a0662fd677630e7265c5455bfdcc39f7a4928b574a975b4",
      "size": 1112
    },
    {
      "path": "fixes/generic/fix.generic.disable_device.json",
      "sha256": "58191aff881fc20e582ae3309be9d4649f79e2730066995de048f03618c34036",
      "size": 1131
    },
    {
      "path": "fixes/generic/fix.generic.disable_startup_hkcu.json",
      "sha256": "c1548a6984220146963e05e88d65d287c43c33b2fdcf63e710debad09c9435da",
      "size": 1140
    },
    {
      "path": "fixes/generic/fix.generic.disable_startup_hklm.json",
      "sha256": "ddfdc2badc17f12e5c99427416311739ced7c6534f25edc08f9f28f21f016b73",
      "size": 1139
    },
    {
      "path": "fixes/generic/fix.generic.remove_compat_layer.json",
      "sha256": "099c12693cf566031107272ae9ea118db789bd4af182ca186e8452717c808222",
      "size": 1255
    },
    {
      "path": "fixes/generic/fix.generic.unbind_ipv6.json",
      "sha256": "3ffe42fa85af1526971093e84a1aee3996944bb566372e5a3f07cc11ff0af165",
      "size": 1296
    },
    {
      "path": "fixes/input/fix.input.mouse_accel_off.json",
      "sha256": "9f909bbd8d4a11b5a1156970cfaacd5a24a35a27f03e65464f5b2e4b84c4d54d",
      "size": 1659
    },
    {
      "path": "fixes/net/fix.net.disable_second_adapter.json",
      "sha256": "5c7ea89b8f4c80e0e80a64d87763a6318e3f1f2b4650971ce1c29ed5f9304142",
      "size": 1900
    },
    {
      "path": "fixes/net/fix.net.disable_unused_adapter.json",
      "sha256": "da3c1f32897d06ba84f81f04fc05b905287858ebef531a4dda1cf76236b71ddb",
      "size": 2002
    },
    {
      "path": "fixes/net/fix.net.dns_flush.json",
      "sha256": "00ea73c3713fd1310a4bf7cd902df6cb3aadf307ee47be1bc7c99d72cbf55374",
      "size": 848
    },
    {
      "path": "fixes/net/fix.net.realtek_power_saving_off.json",
      "sha256": "95317f6c4aa392652a0b4ecf63528d44999f3c331b17f7cd6b50b79aed824de2",
      "size": 2343
    },
    {
      "path": "fixes/net/fix.net.unbind_ipv6_active.json",
      "sha256": "cc0d2fe808398b5271395899a595e6ce3f73f547df39534e76246e0ef31bb4cc",
      "size": 1530
    },
    {
      "path": "fixes/net/fix.net.winsock_reset.json",
      "sha256": "a380dbf505c8e8cbe6e99ec539012f3cafe8ee4581ab51dd2ab2bb91fb2335b8",
      "size": 1226
    },
    {
      "path": "fixes/os/fix.os.fast_startup_off.json",
      "sha256": "b1e4a181bdc6cfda1f205268e6b881245347cd75a87df4dcb102627772375e63",
      "size": 1436
    },
    {
      "path": "fixes/os/fix.os.time_resync.json",
      "sha256": "4436d9743d8cace8f4c7cd4a7cf5a3421318b76d94ab4f6ddb0518406a7c8763",
      "size": 883
    },
    {
      "path": "fixes/power/fix.power.cpu_max_100.json",
      "sha256": "d87d5b6fb9de368f0bd512f523655b3eb7c8156d21eae7b68be42f799ff49e4a",
      "size": 1339
    },
    {
      "path": "fixes/power/fix.power.high_performance.json",
      "sha256": "e7c923ec66e2eb366bea2b4aff2caae1cc9d540f6317272d39963954548c9278",
      "size": 1269
    },
    {
      "path": "fixes/power/fix.power.usb_selective_suspend_off.json",
      "sha256": "b8534e8b75b1e6ff77d03076a2e0444fcb5628ac85c73968e2d96dd70df7fc98",
      "size": 1580
    },
    {
      "path": "fixes/proc/fix.proc.close_overlays.json",
      "sha256": "ffa9c7bc7189c9c09d5214db6f3536c62831a2c5981a6ecd296cad68ab9cbc2c",
      "size": 1301
    },
    {
      "path": "fixes/riot/fix.riot.client_runasadmin.json",
      "sha256": "3c551433a17a531bace1aa520f4a9d5e492f1e6e5e7f70bd5be2ce182a31686b",
      "size": 1282
    },
    {
      "path": "fixes/sec/fix.sec.remove_riot_perfoptions.json",
      "sha256": "fc28101192329817e16affce4639a72f2e80c101dc21b777a50f6e5726c2b87e",
      "size": 1222
    },
    {
      "path": "fixes/sec/fix.sec.reset_exploit_overrides.json",
      "sha256": "c4d98e2edb0bfa03154006c91f22a2ff96edac3f19e193fcb97e260205fc9dc0",
      "size": 1231
    },
    {
      "path": "fixes/svc/fix.svc.disable_conflict_service.json",
      "sha256": "29480181cfb95baa528b430ca79ff3341704727b01418faac9be5d71362dabba",
      "size": 1608
    },
    {
      "path": "fixes/vg/fix.vg.quarantine_bootstatus.json",
      "sha256": "d65ddd548662413b072420cc0ff0cd8ef9af13fbf37c9cd48eff9445b2308e17",
      "size": 1216
    },
    {
      "path": "fixes/vg/fix.vg.quarantine_stale_dat.json",
      "sha256": "853b4d677484c22234d9c2f6571ba90d0de22aa29c6a0629928c113f3f8b9a69",
      "size": 1177
    },
    {
      "path": "fixes/vg/fix.vg.vgc_automatic.json",
      "sha256": "b111de9dd8591640420ba6efc8ccb835e21a6f57624adaa5466d0ef257585c1e",
      "size": 1424
    },
    {
      "path": "guides/guide.account.other_account.json",
      "sha256": "934725bdb6f596e5c137eb2e60705ca224d5f89ee1ed51eae65268db90bdaa49",
      "size": 2197
    },
    {
      "path": "guides/guide.apps.close_overlays.json",
      "sha256": "fd5be643da1c5315ea3f9500c4e6426b4fa6b0946d5702549cda72ef5928359f",
      "size": 4033
    },
    {
      "path": "guides/guide.apps.uninstall_bonjour.json",
      "sha256": "9528a2028a5e84958b897aaf9dd0f153e98013c4449a900f89dd4d63e4e731e0",
      "size": 2365
    },
    {
      "path": "guides/guide.apps.uninstall_conflict.json",
      "sha256": "200791b0d70298952e4c1dc7baf64c4d412bfebc231150dd4e5a38f99510aa74",
      "size": 2740
    },
    {
      "path": "guides/guide.apps.uninstall_nahimic.json",
      "sha256": "4b055cc89c5ea7650eac49d8dd8b9323e4c71499678c4bc1c6170d423b3972ea",
      "size": 2709
    },
    {
      "path": "guides/guide.audio.bt_handsfree.json",
      "sha256": "a673f78b3276204bfa48da9f6f07544125c799cb76d51bd9032f27f5e1c89a29",
      "size": 2955
    },
    {
      "path": "guides/guide.audio.output_device.json",
      "sha256": "545c88bad5256dd0688f1c3320a467f26134bb57f03be908d8ac120424d768ea",
      "size": 3486
    },
    {
      "path": "guides/guide.av.exclusions.json",
      "sha256": "6f7d3ad68764aee260e3b558e89b5e21b8d2a610e3038233df5533549e858c08",
      "size": 4089
    },
    {
      "path": "guides/guide.bcd.restore_security.json",
      "sha256": "af652b9979122ccea2ab21cd92fa3a419bfe24eda8b96250cce2f8aec22786b0",
      "size": 4939
    },
    {
      "path": "guides/guide.bios.update.json",
      "sha256": "3a85be08763f7cd4557bdbd76ad4f2840f71c6b9df5a43e1cbb87eb2002bc7f5",
      "size": 4134
    },
    {
      "path": "guides/guide.boot.dualboot.json",
      "sha256": "a80cc388f6535ce3aab00203938810bd40360c59bc4f887a6bce02c9c2c36851",
      "size": 3019
    },
    {
      "path": "guides/guide.clock.fix.json",